{"counts":{"aggregateQueries":1,"chineseNameCondition":989,"cumulativeChineseName":988,"cumulativeIdCardNo":988,"cumulativePosition":10,"cumulativeWorkBaseSi":0,"employeeDetailCalls":0,"idCardNoCondition":988,"modelCalls":0,"otherEmployeeEndpointCalls":0,"positionCondition":10,"resultRows":1,"resumeCount":0,"retryCount":0,"totalRows":990,"workBaseSiCondition":0},"diagnosis":{"firstZeroStage":"work_base_si","qualifiedInputAvailable":false,"reason":"no_qualified_input"},"recordedAt":"2026-08-14T05:03:21.761338400Z","runId":"employee-egress-input-qualification-diagnostic-v2-20260814-run-01","safety":{"fieldValuesPersisted":false,"identifierPersisted":false,"jwtRead":false,"llmApiKeyRead":false,"logLeakCount":0,"modelOutbound":false,"rawLogsDeleted":true,"rawRowsPersisted":false},"schemaVersion":1,"sourceEvidence":{"candidateLifecycleSha256":"570295951f8bf1a109156c017c30609ca548bfba3f021bff4cd2825f978ac231","candidateResultSha256":"7534b1d04a1512720dcbee1fe630114fb1f08bf9c3615dec1d2cb18bec4d5054","candidateRunId":"employee-egress-input-qualification-v2-20260814-candidate-02"},"status":"completed","workPackageId":"WP-EMP-EGRESS-INPUT-QUALIFY-DIAG-02"}
